{
  "id": "minimal-pack",
  "name": "Minimal Pack",
  "version": "0.1.0",
  "description": "The smallest valid Agent Pack manifest.",
  "capabilities": [
    {
      "type": "skill",
      "name": "Minimal skill",
      "source": "https://example.com/skills/minimal",
      "format": "agent-skill",
      "entry": "SKILL.md",
      "upstreamSource": "https://github.com/example/skills/tree/main/minimal"
    }
  ],
  "upstreamSource": "https://github.com/example/agent-packs/tree/main/minimal-pack"
}
