{
  "id": "pr-review",
  "name": "PR Review Pack",
  "version": "0.1.0",
  "description": "A starter pack for coding agents reviewing pull requests and identifying regressions.",
  "license": "Apache-2.0",
  "tags": [
    "github",
    "review",
    "ci",
    "quality"
  ],
  "skills": [
    "code-review-workflow"
  ],
  "plugins": [
    "github-pr-inspection"
  ],
  "upstreamSource": "https://github.com/sandeshh/agent-packs/tree/main/registry/packs/pr-review.json"
}
